{
  "run_id": "RUN-DEMO",
  "project_name": "EXEMPLO-SEM-REPOSITORIO",
  "repository_revision": "snapshot-demonstracao-sem-repositorio",
  "target": "synthetic-demo-only",
  "authorization": {
    "mode": "READ_ONLY",
    "dynamic_tests_authorized": false,
    "external_network_authorized": false,
    "remote_publication_authorized": false
  },
  "status": "PARTIAL",
  "profiles": ["synthetic-example"],
  "languages": [],
  "inventory_refs": ["A-DEMO"],
  "threat_model_ref": null,
  "tasks": [
    {"task_id": "TASK-DEMO-SEC-03", "scope_id": "SCOPE-DEMO", "domain": "03", "agent": "security", "status": "SKIPPED", "result_ref": null}
  ],
  "limitations": ["Exemplo apenas para validação de schema; não corresponde a auditoria realizada."],
  "output_root": "docs/security-audit/",
  "artifacts": [],
  "checkpoint_ref": null
}
